{
  "$schema": "../schemas/profile.schema.json",
  "schemaVersion": 1,
  "id": "geany",
  "name": "Geany (Debian trixie ARM64)",
  "display": {"dpi": 144, "socket": "filesystem"},
  "compatibility": ["android-seccomp", "android-dns", "android-tmp"],
  "launch": {
    "mode": "loader",
    "loader": "${RUNTIME}/usr/lib/ld-linux-aarch64.so.1",
    "libraryPath": "${RUNTIME}/usr/lib:${RUNTIME}/usr/lib/aarch64-linux-gnu",
    "executable": "${RUNTIME}/usr/bin/geany",
    "workingDirectory": "${HOME}",
    "arguments": ["--new-instance", "${APP}/fixtures/bionicx-example.c"],
    "environment": {
      "DISPLAY": "${DISPLAY}", "HOME": "${HOME}", "TMPDIR": "${CACHE}",
      "XDG_RUNTIME_DIR": "${TMP}/runtime", "XDG_CONFIG_HOME": "${HOME}/.config",
      "XDG_CACHE_HOME": "${HOME}/.cache", "XDG_DATA_HOME": "${HOME}/.local/share",
      "XDG_DATA_DIRS": "${RUNTIME}/usr/local/share:${RUNTIME}/usr/share",
      "FONTCONFIG_PATH": "${RUNTIME}/etc/fonts", "FONTCONFIG_FILE": "fonts.conf",
      "GSETTINGS_SCHEMA_DIR": "${RUNTIME}/usr/share/glib-2.0/schemas",
      "GSETTINGS_BACKEND": "memory",
      "GDK_PIXBUF_MODULE_FILE": "${RUNTIME}/usr/lib/aarch64-linux-gnu/gdk-pixbuf-2.0/2.10.0/loaders.cache",
      "DBUS_SESSION_BUS_ADDRESS": "disabled:", "NO_AT_BRIDGE": "1",
      "BIONICX_ROOTFS": "${RUNTIME}",
      "PATH": "${RUNTIME}/usr/bin:${RUNTIME}/bin:/product/bin:/system/bin", "LANG": "C.UTF-8"
    }
  }
}
