{
  "$schema": "../schemas/profile.schema.json",
  "schemaVersion": 1,
  "id": "x11-probe",
  "name": "BionicX core X11 integration probe",
  "display": {"dpi": 144, "socket": "filesystem"},
  "launch": {
    "mode": "loader",
    "loader": "${RUNTIME}/usr/lib/ld-linux-aarch64.so.1",
    "libraryPath": "${APP}/lib:${RUNTIME}/usr/lib",
    "executable": "${APP}/bin/x11-probe",
    "workingDirectory": "${APP}",
    "arguments": ["--duration", "12"],
    "environment": {
      "DISPLAY": "${DISPLAY}",
      "HOME": "${HOME}",
      "TMPDIR": "${TMP}",
      "LANG": "C.UTF-8"
    }
  }
}
