{
  "$schema": "../schemas/profile.schema.json",
  "schemaVersion": 1,
  "id": "chrome",
  "name": "Google Chrome stable ARM64 smoke test",
  "display": {"dpi": 144, "socket": "filesystem"},
  "compatibility": ["android-seccomp", "android-dns", "chrome"],
  "launch": {
    "mode": "direct",
    "executable": "${APP}/opt/google/chrome/chrome",
    "workingDirectory": "${APP}/opt/google/chrome",
    "argv0": "${APP}/opt/google/chrome/google-chrome",
    "arguments": [
      "--no-sandbox",
      "--disable-breakpad",
      "--disable-crashpad-for-testing",
      "--disable-gpu",
      "--disable-dev-shm-usage",
      "--no-first-run",
      "--no-default-browser-check",
      "--window-position=0,0",
      "--window-size=1920,1080",
      "--start-maximized",
      "--user-data-dir=${HOME}/profile",
      "--ozone-platform=x11",
      "--ui-toolkit=gtk",
      "--enable-logging=stderr",
      "about:blank"
    ],
    "environment": {
      "DISPLAY": "${DISPLAY}",
      "GLADIO_X11_SOCKET": "/data/data/io.taowen.bx/files/rootfs/tmp/.X11-unix/X0",
      "HOME": "${HOME}",
      "TMPDIR": "${TMP}",
      "XDG_RUNTIME_DIR": "${TMP}/runtime",
      "XDG_DATA_DIRS": "${APP}/share",
      "CHROME_WRAPPER": "${APP}/opt/google/chrome/google-chrome",
      "CHROME_VERSION_EXTRA": "stable",
      "GNOME_DISABLE_CRASH_DIALOG": "SET_BY_GOOGLE_CHROME",
      "FONTCONFIG_PATH": "${APP}/etc/fonts",
      "FONTCONFIG_FILE": "fonts.conf",
      "GSETTINGS_SCHEMA_DIR": "${APP}/share/glib-2.0/schemas",
      "GSETTINGS_BACKEND": "memory",
      "GDK_PIXBUF_MODULE_FILE": "${APP}/lib/gdk-pixbuf-2.0/2.10.0/loaders.cache",
      "LD_LIBRARY_PATH": "${APP}/lib:${APP}/opt/google/chrome:${RUNTIME}/usr/lib",
      "LANG": "C"
    }
  }
}
